{
  "schema_name": "DoclingDocument",
  "version": "1.10.0",
  "name": "synthetic-direct-pdf",
  "pages": {
    "1": { "page_no": 1, "size": { "width": 612, "height": 792 } },
    "2": { "page_no": 2, "size": { "width": 612, "height": 792 } }
  },
  "texts": [
    {
      "self_ref": "#/texts/0",
      "text": "Invoice 1007",
      "prov": [
        { "page_no": 1, "bbox": { "l": 72, "t": 72, "r": 180, "b": 90, "coord_origin": "TOPLEFT" }, "charspan": [0, 12] }
      ]
    },
    {
      "self_ref": "#/texts/1",
      "text": "Continuation",
      "prov": [
        { "page_no": 2, "bbox": { "l": 72, "t": 740, "r": 180, "b": 720, "coord_origin": "BOTTOMLEFT" }, "charspan": [0, 12] }
      ]
    }
  ],
  "tables": [
    {
      "self_ref": "#/tables/0",
      "prov": [
        { "page_no": 1, "bbox": { "l": 72, "t": 120, "r": 360, "b": 240, "coord_origin": "TOPLEFT" }, "charspan": [0, 0] }
      ],
      "data": {
        "num_rows": 2,
        "num_cols": 3,
        "table_cells": [
          {
            "bbox": { "l": 72, "t": 120, "r": 264, "b": 150, "coord_origin": "TOPLEFT" },
            "row_span": 1,
            "col_span": 2,
            "start_row_offset_idx": 0,
            "end_row_offset_idx": 1,
            "start_col_offset_idx": 0,
            "end_col_offset_idx": 2,
            "text": ""
          },
          {
            "bbox": { "l": 264, "t": 120, "r": 360, "b": 150, "coord_origin": "TOPLEFT" },
            "row_span": 1,
            "col_span": 1,
            "start_row_offset_idx": 0,
            "end_row_offset_idx": 1,
            "start_col_offset_idx": 2,
            "end_col_offset_idx": 3,
            "text": "0"
          },
          {
            "bbox": { "l": 72, "t": 150, "r": 168, "b": 180, "coord_origin": "TOPLEFT" },
            "row_span": 1,
            "col_span": 1,
            "start_row_offset_idx": 1,
            "end_row_offset_idx": 2,
            "start_col_offset_idx": 0,
            "end_col_offset_idx": 1,
            "text": "null"
          },
          {
            "bbox": null,
            "row_span": 1,
            "col_span": 1,
            "start_row_offset_idx": 1,
            "end_row_offset_idx": 2,
            "start_col_offset_idx": 1,
            "end_col_offset_idx": 2
          },
          {
            "bbox": { "l": 264, "t": 150, "r": 360, "b": 180, "coord_origin": "TOPLEFT" },
            "row_span": 1,
            "col_span": 1,
            "start_row_offset_idx": 1,
            "end_row_offset_idx": 2,
            "start_col_offset_idx": 2,
            "end_col_offset_idx": 3,
            "text": "paid"
          }
        ]
      }
    }
  ]
}
